{
  "g": 1,
  "kind": "procedure",
  "key": "DRAWING_REVISION",
  "name": "Drawing revision",
  "description": "v3 (W5 card, 2026-09-12; decisions #123–#125): the drawings track of a settings change, authored in the definitions screen. Step 14a identifies the drawings the change touches — or records that none are affected, which the owner says is the case for most settings changes (rationale documents change, drawings often do not); only when drawings are affected does 14b record the revision. The people who revise drawings work outside the platform in the drawing system, so 14b records what they did: the link to the revised set, its revision label and the date the revision was made. Drawing references stay text for Phase 1; the pattern drawing revisions follow is to be discussed and documented later, and a check step is a document edit for a later stage. Called by SETTINGS_CHANGE at COMPLETION over the same work request. v2 (W5) carried the legacy track's fields; v1 (W4) was a placeholder.",
  "subjectKind": "WorkRequest",
  "roles": {
    "engineer": { "role": "PCEngineer" }
  },
  "outcomes": ["Completed"],
  "body": {
    "block": "sequence",
    "id": "MAIN",
    "items": [
      {
        "block": "step",
        "id": "IDENTIFY_DRAWINGS",
        "title": "[14a] Identify the drawings affected by the change",
        "instruction": "List every drawing the settings change touches — schematics, wiring, setting sheets, one-lines — by its drawing number as the drawing system knows it, and commit Done. If the change touches no drawing (the rationale document changes, the drawings do not), commit NoneAffected and this track ends here.",
        "role": "engineer",
        "capture": {
          "drawingReferences": { "type": "text" },
          "note": { "type": "text" }
        },
        "outcomes": ["Done", "NoneAffected"],
        "record": { "kind": "ScopeDecision" }
      },
      {
        "block": "choice",
        "id": "DRAWINGS_AFFECTED",
        "title": "Only when drawings are affected",
        "cases": [
          {
            "title": "Drawings affected",
            "when": "step.outcome[id='IDENTIFY_DRAWINGS'] = 'Done'",
            "body": {
              "block": "step",
              "id": "RECORD_REVISION",
              "title": "[14b] Record the drawing revision",
              "instruction": "The drawing office revises the drawings in the drawing system, outside this platform. When they have, record what they did: the link to the revised set, its revision label, the date the revision was made and any note. The platform keeps this reference; the drawing system keeps the file.",
              "role": "engineer",
              "capture": {
                "documentLink": { "type": "text", "required": true },
                "revisionLabel": { "type": "text" },
                "revisedOn": { "type": "date", "required": true },
                "note": { "type": "text" }
              },
              "record": { "kind": "DrawingUpdate" }
            }
          }
        ]
      }
    ]
  }
}
